<?xml version="1.0" encoding="UTF-8"?>
<xs:schema xmlns:xs="http://www.w3.org/2001/XMLSchema">
    <xs:element name="Factura">
        <xs:complexType>
            <xs:sequence>
                <xs:element name="factura">
                    <xs:complexType>
                        <xs:sequence>
                            <xs:element name="nombre" type="xs:string" />
                            <xs:element name="direccion">
                                <xs:complexType>
                                    <xs:sequence>
                                        <xs:element name="calle" type="xs:string" />
                                        <xs:element name="provincia" type="xs:string" />
                                        <xs:element name="codi_postal" type="xs:string" />
                                    </xs:sequence>
                                </xs:complexType>
                            </xs:element>
                            <xs:element name="n_CIF" type="xs:string" />
                            <xs:element name="telefono" type="xs:string" />
                            <xs:element name="fax" type="xs:string" />
                            <xs:element name="fecha">
                                <xs:complexType>
                                    <xs:sequence>
                                        <xs:element name="dia" type="xs:string" />
                                        <xs:element name="mes" type="xs:string" />
                                        <xs:element name="aÃ±o" type="xs:string" />
                                    </xs:sequence>
                                </xs:complexType>
                            </xs:element>
                            <xs:element name="pedido">
                                <xs:complexType>
                                    <xs:attribute name="id" type="xs:integer" use="required" />
                                </xs:complexType>
                            </xs:element>
                            <xs:element name="forma_de_pago" type="xs:string" />
                        </xs:sequence>
                        <xs:attribute name="id" type="xs:integer" use="required" />
                    </xs:complexType>
                </xs:element>
                <xs:element name="datos_cliente">
                    <xs:complexType>
                        <xs:sequence>
                            <xs:element name="numero_cliente" type="xs:string" />
                            <xs:element name="nombre" type="xs:string" />
                            <xs:element name="direccion" type="xs:string" />
                            <xs:element name="poblacion" type="xs:string" />
                            <xs:element name="codigo_postal" type="xs:string" />
                            <xs:element name="provincia" type="xs:string" />
                        </xs:sequence>
                    </xs:complexType>
                </xs:element>
                <xs:element name="datos_factura">
                    <xs:complexType>
                        <xs:sequence>
                            <xs:element name="producto">
                                <xs:complexType>
                                    <xs:sequence>
                                        <xs:element name="n_ref" type="xs:string" />
                                        <xs:element name="descripcion" type="xs:string" />
                                        <xs:element name="cantidad" type="xs:string" />
                                        <xs:element name="precio" type="xs:string" />
                                        <xs:element name="iva" type="xs:string" />
                                        <xs:element name="importe" type="xs:string" />
                                    </xs:sequence>
                                </xs:complexType>
                            </xs:element>
                            <xs:element name="productos" maxOccurs="unbounded">
                                <xs:complexType>
                                    <xs:sequence>
                                        <xs:element name="n_ref" type="xs:string" />
                                        <xs:element name="descripcion" minOccurs="0"
                                            type="xs:string" />
                                        <xs:element name="cantidad" type="xs:string" />
                                        <xs:element name="precio" type="xs:string" />
                                        <xs:element name="iva" type="xs:string" />
                                        <xs:element name="importe" minOccurs="0" type="xs:string" />
                                        <xs:element name="descripcion" minOccurs="0"
                                            type="xs:string" />
                                        <xs:element name="Importe" minOccurs="0" type="xs:string" />
                                    </xs:sequence>
                                </xs:complexType>
                            </xs:element>
                            <xs:element name="base_imponible" type="xs:string" />
                            <xs:element name="cant_iva" type="xs:string" />
                            <xs:element name="cuota_iva" type="xs:string" />
                            <xs:element name="total_factura" type="xs:string" />
                        </xs:sequence>
                    </xs:complexType>
                </xs:element>
            </xs:sequence>
        </xs:complexType>
    </xs:element>
</xs:schema>