<?xml version="1.0" encoding="UTF-8"?>
<?xml-stylesheet href="actividad15.xsl" type="text/xsl"?>   
<Factura xmlns:xsi="http://www.w3.org/2001/XMLSchema-instance"
 xsi:noNamespaceSchemaLocation="actividad23.xsd">
    <factura id="999">

        <nombre>Equipos Digitals S.L.</nombre>
        <direccion>
            <calle>AV.Valladolid</calle>
            <provincia>Madrid</provincia>
            <codi_postal>28015</codi_postal>
        </direccion>
        <n_CIF>Q-9876543</n_CIF>
        <telefono>917776688</telefono>
        <fax>917776699</fax>
        <fecha>
            <dia>12</dia>
            <mes>1</mes>
            <año>2005</año>
        </fecha>
        <pedido id="731"></pedido>
        <forma_de_pago>Efectivo</forma_de_pago>
    </factura>

    <datos_cliente>

        <numero_cliente>879</numero_cliente>
        <nombre>Darío Bueno Gutiérrez</nombre>
        <direccion> AV.Oporto n7 4d</direccion> 
        <poblacion>Madrid</poblacion>
        <codigo_postal>28043</codigo_postal>
        <provincia>Madrid</provincia>

    </datos_cliente>

    <datos_factura>

        <productos>

            <n_ref>MII93000F</n_ref>
            <descripcion>Micro pentium IV 3000MHZ FB800</descripcion>
            <cantidad>1</cantidad>
            <precio>230 euro</precio>
            <iva>16%</iva>
            <importe>266.80 euro</importe>
        </productos>

        <productos>
            <n_ref> MB8QDIp4 </n_ref>
            <descripcion>Placa base QDI P4</descripcion>
            <cantidad>1</cantidad>
            <precio>180 euro</precio>
            <iva>16%</iva>
            <importe>208.80 euro</importe>
        </productos>

        <productos>
            <n_ref>MEDD512M32</n_ref>
            <descripcion>DIMM DDR 512MB 3200</descripcion>
            <cantidad>2</cantidad>
            <precio>40 eurp</precio>
            <iva>16%</iva>
            <importe>92.80 euro</importe>
        </productos>

        <productos>
            <n_ref>HD250GSA7</n_ref>
            <descripcion>DISCO DURO 250GB S-ATA 7200</descripcion>
            <cantidad>4</cantidad>
            <precio>120 euro</precio>
            <iva>16%</iva>
            <Importe>556.80 euro</Importe>
        </productos>

        <base_imponible>970.00 euro</base_imponible>
        <cant_iva>16%</cant_iva>
        <cuota_iva>155.20 euro</cuota_iva>
        <total_factura>1125.20 euro</total_factura>
        
    </datos_factura>

</Factura>